{
  "$schema": "https://json-schema.org/draft/2020-12/schema",
  "additionalProperties": false,
  "properties": {
    "api_request_parameters": {"type": "object"},
    "api_type": {"const": "RESPONSES_API"},
    "authorization": {"type": "object"},
    "automatic_success_thresholds": {"type": "object"},
    "budgets_usd": {"type": "object"},
    "case_counts": {"type": "object"},
    "data_policy": {"const": "SYNTHETIC_FIXTURES_ONLY"},
    "internal_semantics": {"type": "object"},
    "limits": {"type": "object"},
    "manual_scoring_thresholds": {"type": "object"},
    "max_input_tokens_per_request": {"const": 20000},
    "model_id": {"const": "gpt-5.6-terra"},
    "plan_status": {"const": "FROZEN"},
    "plan_version": {"const": "1.0.1"},
    "release": {"type": "object"},
    "sdk_transport": {"type": "object"},
    "stop_conditions": {"items": {"type": "string"}, "type": "array"},
    "token_bound": {"type": "object"}
  },
  "required": [
    "api_request_parameters",
    "api_type",
    "authorization",
    "automatic_success_thresholds",
    "budgets_usd",
    "case_counts",
    "data_policy",
    "internal_semantics",
    "limits",
    "manual_scoring_thresholds",
    "max_input_tokens_per_request",
    "model_id",
    "plan_status",
    "plan_version",
    "release",
    "sdk_transport",
    "stop_conditions",
    "token_bound"
  ],
  "title": "M1-A Real Model Evaluation Plan V1.0.1",
  "type": "object"
}
