{
  "api_request_parameters": {
    "conversation": "OMITTED",
    "max_output_tokens": 25000,
    "model": "gpt-5.6-terra",
    "previous_response_id": "OMITTED",
    "reasoning": {
      "effort": "medium"
    },
    "store": false,
    "tools": []
  },
  "api_type": "RESPONSES_API",
  "authorization": {
    "M1_A_FULL_FIXTURE_EVALUATION_AUTHORIZED": false,
    "M1_A_MODEL_EVALUATION_AUTHORIZED": false,
    "M1_A_SENTINEL_EVALUATION_AUTHORIZED": false
  },
  "automatic_success_thresholds": {
    "all_selected_cases_require_qualified_assembly": true,
    "catalog_hash_mismatches": 0,
    "program_hash_mismatches": 0,
    "release_gate_changes": 0,
    "validator_hard_violations": 0
  },
  "budgets_usd": {
    "accounting_mode": "FAIL_CLOSED_RESERVED_BUDGET",
    "full_fixture": "15.50",
    "model_price_claimed": false,
    "sentinel": "4.00",
    "total_evaluation": "22.00"
  },
  "case_counts": {
    "full_fixture": 17,
    "sentinel": 4
  },
  "data_policy": "SYNTHETIC_FIXTURES_ONLY",
  "internal_semantics": {
    "context_policy": "current_turn_only",
    "execution_mode": "standard"
  },
  "limits": {
    "full_fixture_max_requests": 34,
    "max_repairs_per_fixture": 1,
    "max_requests_per_fixture": 2,
    "sentinel_max_requests": 8
  },
  "manual_scoring_thresholds": {
    "all_selected_cases_require_review": true,
    "default_review_status": "UNREVIEWED",
    "full_fixture": {
      "budget_usd_at_most": "15.50",
      "clear_value_add_at_least": "14/17",
      "final_validator_success": "17/17",
      "first_attempt_success_at_least": "14/17",
      "fourteen_dimension_average_each_case_at_least": 4.0,
      "hard_risk_true_count": 0,
      "material_evidence_vagueness": 0,
      "no_value_add": 0,
      "overall_average_at_least": 4.2,
      "program_and_evidence_fidelity_each_case_at_least": 4,
      "unresolved_provider_failure": 0
    },
    "hard_risks": {
      "irreversible_instruction_present": false,
      "mind_reading_present": false,
      "outcome_guarantee_present": false,
      "repeat_output_principle_conflict": false
    },
    "manual_review_cannot_open_release_gate": true,
    "numeric_release_threshold_frozen": true,
    "sentinel": {
      "budget_usd_at_most": "4.00",
      "clear_value_add_at_least": "3/4",
      "final_validator_success": "4/4",
      "first_attempt_success_at_least": "3/4",
      "fourteen_dimension_average_each_case_at_least": 4.0,
      "hard_risk_true_count": 0,
      "manual_review_pass": "4/4",
      "program_and_evidence_fidelity_each_case_at_least": 4,
      "unresolved_provider_failure": 0
    }
  },
  "max_input_tokens_per_request": 20000,
  "model_id": "gpt-5.6-terra",
  "plan_status": "FROZEN",
  "plan_version": "1.0.1",
  "release": {
    "NarrativeReleaseStatus": "UNVERIFIED",
    "closed_beta_allowed": false,
    "formal_report_persistence_allowed": false,
    "should_charge": false
  },
  "sdk_transport": {
    "max_retries": 0,
    "timeout_seconds": 120.0
  },
  "stop_conditions": [
    "ANY_AUTHORIZATION_GATE_MISSING",
    "INPUT_TOKEN_LIMIT_EXCEEDED",
    "REQUEST_OR_REPAIR_LIMIT_EXCEEDED",
    "STAGE_OR_TOTAL_BUDGET_EXCEEDED",
    "PROGRAM_OR_CATALOG_HASH_CHANGED",
    "STRUCTURED_OUTPUT_OR_VALIDATOR_FAILURE_AFTER_ONE_REPAIR",
    "ANY_RELEASE_GATE_CHANGE",
    "ANY_REAL_USER_DATA_OR_API_KEY_IN_EXPORT"
  ],
  "token_bound": {
    "bound_method": "UTF8_BYTES_CONSERVATIVE",
    "is_exact_token_count": false,
    "truncate_on_exceed": false
  }
}
